{
  "schema": "eval.trace/1",
  "scenario": "loop",
  "duration_frames": 240,
  "viewport": {
    "w": 1280,
    "h": 720
  },
  "events": [
    {
      "frame": 0,
      "type": "click",
      "x": 640,
      "y": 185
    },
    {
      "frame": 108,
      "type": "keydown",
      "code": "ArrowLeft"
    },
    {
      "frame": 110,
      "type": "keyup",
      "code": "ArrowLeft"
    },
    {
      "frame": 120,
      "type": "keydown",
      "code": "ArrowDown"
    },
    {
      "frame": 122,
      "type": "keyup",
      "code": "ArrowDown"
    },
    {
      "frame": 132,
      "type": "keydown",
      "code": "ArrowUp"
    },
    {
      "frame": 134,
      "type": "keyup",
      "code": "ArrowUp"
    },
    {
      "frame": 142,
      "type": "keydown",
      "code": "ArrowLeft"
    },
    {
      "frame": 144,
      "type": "keydown",
      "code": "ArrowRight"
    },
    {
      "frame": 144,
      "type": "keyup",
      "code": "ArrowLeft"
    },
    {
      "frame": 146,
      "type": "keyup",
      "code": "ArrowRight"
    },
    {
      "frame": 156,
      "type": "keydown",
      "code": "ArrowLeft"
    },
    {
      "frame": 168,
      "type": "keydown",
      "code": "ArrowDown"
    },
    {
      "frame": 170,
      "type": "keyup",
      "code": "ArrowDown"
    },
    {
      "frame": 180,
      "type": "keydown",
      "code": "ArrowUp"
    },
    {
      "frame": 181,
      "type": "keyup",
      "code": "ArrowLeft"
    },
    {
      "frame": 182,
      "type": "keyup",
      "code": "ArrowUp"
    },
    {
      "frame": 193,
      "type": "keydown",
      "code": "ArrowRight"
    },
    {
      "frame": 195,
      "type": "keyup",
      "code": "ArrowRight"
    }
  ]
}
