{
  "schema": "eval.trace/1",
  "scenario": "clear",
  "duration_frames": 300,
  "viewport": {
    "w": 1280,
    "h": 720
  },
  "events": [
    {
      "frame": 0,
      "type": "keydown",
      "code": "Enter"
    },
    {
      "frame": 1,
      "type": "keyup",
      "code": "Enter"
    },
    {
      "frame": 102,
      "type": "keydown",
      "code": "ArrowLeft"
    },
    {
      "frame": 103,
      "type": "keyup",
      "code": "ArrowLeft"
    },
    {
      "frame": 114,
      "type": "keydown",
      "code": "ArrowDown"
    },
    {
      "frame": 115,
      "type": "keyup",
      "code": "ArrowDown"
    },
    {
      "frame": 126,
      "type": "keydown",
      "code": "ArrowUp"
    },
    {
      "frame": 127,
      "type": "keyup",
      "code": "ArrowUp"
    },
    {
      "frame": 138,
      "type": "keydown",
      "code": "ArrowRight"
    },
    {
      "frame": 139,
      "type": "keyup",
      "code": "ArrowRight"
    },
    {
      "frame": 151,
      "type": "keydown",
      "code": "ArrowLeft"
    },
    {
      "frame": 152,
      "type": "keyup",
      "code": "ArrowLeft"
    },
    {
      "frame": 163,
      "type": "keydown",
      "code": "ArrowDown"
    },
    {
      "frame": 164,
      "type": "keyup",
      "code": "ArrowDown"
    },
    {
      "frame": 175,
      "type": "keydown",
      "code": "ArrowUp"
    },
    {
      "frame": 176,
      "type": "keyup",
      "code": "ArrowUp"
    },
    {
      "frame": 187,
      "type": "keydown",
      "code": "ArrowRight"
    },
    {
      "frame": 188,
      "type": "keyup",
      "code": "ArrowRight"
    },
    {
      "frame": 199,
      "type": "keydown",
      "code": "ArrowLeft"
    },
    {
      "frame": 200,
      "type": "keyup",
      "code": "ArrowLeft"
    },
    {
      "frame": 211,
      "type": "keydown",
      "code": "ArrowDown"
    },
    {
      "frame": 212,
      "type": "keyup",
      "code": "ArrowDown"
    },
    {
      "frame": 223,
      "type": "keydown",
      "code": "ArrowUp"
    },
    {
      "frame": 224,
      "type": "keyup",
      "code": "ArrowUp"
    },
    {
      "frame": 235,
      "type": "keydown",
      "code": "ArrowRight"
    },
    {
      "frame": 236,
      "type": "keyup",
      "code": "ArrowRight"
    },
    {
      "frame": 248,
      "type": "keydown",
      "code": "ArrowLeft"
    },
    {
      "frame": 249,
      "type": "keyup",
      "code": "ArrowLeft"
    },
    {
      "frame": 260,
      "type": "keydown",
      "code": "ArrowDown"
    },
    {
      "frame": 261,
      "type": "keyup",
      "code": "ArrowDown"
    },
    {
      "frame": 272,
      "type": "keydown",
      "code": "ArrowUp"
    },
    {
      "frame": 273,
      "type": "keyup",
      "code": "ArrowUp"
    },
    {
      "frame": 284,
      "type": "keydown",
      "code": "ArrowRight"
    },
    {
      "frame": 285,
      "type": "keyup",
      "code": "ArrowRight"
    }
  ]
}
