{
  "schema": "eval.trace/1",
  "scenario": "clear",
  "duration_frames": 570,
  "viewport": { "w": 1280, "h": 720 },
  "events": [
    { "frame": 8, "type": "click", "x": 340, "y": 250 },
    { "frame": 16, "type": "click", "x": 640, "y": 655 },
    { "frame": 24, "type": "mouse_down", "x": 178, "y": 324 },
    { "frame": 26, "type": "mouse_up", "x": 688, "y": 256 },
    { "frame": 34, "type": "mouse_down", "x": 178, "y": 256 },
    { "frame": 36, "type": "mouse_up", "x": 940, "y": 328 },
    { "frame": 44, "type": "click", "x": 180, "y": 655 },
    { "frame": 52, "type": "click", "x": 180, "y": 655 },
    { "frame": 80, "type": "mouse_down", "x": 178, "y": 188 },
    { "frame": 82, "type": "mouse_up", "x": 868, "y": 256 },
    { "frame": 90, "type": "click", "x": 180, "y": 655 },
    { "frame": 98, "type": "click", "x": 180, "y": 655 },
    { "frame": 106, "type": "click", "x": 180, "y": 655 },
    { "frame": 114, "type": "click", "x": 180, "y": 655 },
    { "frame": 122, "type": "click", "x": 180, "y": 655 },
    { "frame": 130, "type": "click", "x": 180, "y": 655 },
    { "frame": 138, "type": "click", "x": 180, "y": 655 },
    { "frame": 146, "type": "click", "x": 180, "y": 655 },
    { "frame": 154, "type": "click", "x": 180, "y": 655 },
    { "frame": 162, "type": "click", "x": 180, "y": 655 },
    { "frame": 170, "type": "click", "x": 180, "y": 655 },
    { "frame": 178, "type": "click", "x": 180, "y": 655 },
    { "frame": 186, "type": "click", "x": 180, "y": 655 },
    { "frame": 194, "type": "click", "x": 180, "y": 655 },
    { "frame": 202, "type": "click", "x": 180, "y": 655 },
    { "frame": 210, "type": "click", "x": 180, "y": 655 },
    { "frame": 218, "type": "click", "x": 180, "y": 655 },
    { "frame": 226, "type": "click", "x": 180, "y": 655 },
    { "frame": 234, "type": "click", "x": 180, "y": 655 },
    { "frame": 242, "type": "click", "x": 180, "y": 655 },
    { "frame": 260, "type": "click", "x": 1130, "y": 428 },
    { "frame": 280, "type": "click", "x": 180, "y": 448 },
    { "frame": 300, "type": "click", "x": 400, "y": 448 },
    { "frame": 320, "type": "click", "x": 620, "y": 448 },
    { "frame": 340, "type": "click", "x": 900, "y": 250 }
  ]
}
