{
  "schema": "eval.trace/1",
  "scenario": "loop",
  "duration_frames": 108,
  "viewport": {
    "w": 1280,
    "h": 720
  },
  "events": [
    {
      "frame": 0,
      "type": "keydown",
      "code": "Enter"
    },
    {
      "frame": 10,
      "type": "keydown",
      "code": "ArrowLeft"
    },
    {
      "frame": 20,
      "type": "keydown",
      "code": "ArrowUp"
    },
    {
      "frame": 52,
      "type": "click",
      "x": 180,
      "y": 655
    },
    {
      "frame": 84,
      "type": "keydown",
      "code": "ArrowLeft"
    }
  ]
}
