{
  "schema": "eval.trace/1",
  "scenario": "loop",
  "duration_frames": 40,
  "viewport": {
    "w": 1280,
    "h": 720
  },
  "events": [
    {
      "frame": 2,
      "type": "keydown",
      "code": "ArrowRight"
    },
    {
      "frame": 3,
      "type": "keyup",
      "code": "ArrowRight"
    },
    {
      "frame": 8,
      "type": "keydown",
      "code": "ArrowRight"
    },
    {
      "frame": 9,
      "type": "keyup",
      "code": "ArrowRight"
    },
    {
      "frame": 14,
      "type": "keydown",
      "code": "ArrowRight"
    },
    {
      "frame": 15,
      "type": "keyup",
      "code": "ArrowRight"
    }
  ]
}
