{
  "schema": "eval.trace/1",
  "scenario": "clear",
  "duration_frames": 182,
  "viewport": {
    "w": 1280,
    "h": 720
  },
  "events": [
    {
      "frame": 0,
      "type": "keydown",
      "code": "Enter"
    },
    {
      "frame": 8,
      "type": "keydown",
      "code": "ArrowUp"
    },
    {
      "frame": 26,
      "type": "keydown",
      "code": "ArrowLeft"
    },
    {
      "frame": 44,
      "type": "keydown",
      "code": "ArrowDown"
    },
    {
      "frame": 62,
      "type": "keydown",
      "code": "ArrowRight"
    },
    {
      "frame": 80,
      "type": "keydown",
      "code": "ArrowDown"
    },
    {
      "frame": 98,
      "type": "keydown",
      "code": "ArrowLeft"
    },
    {
      "frame": 116,
      "type": "keydown",
      "code": "ArrowUp"
    },
    {
      "frame": 134,
      "type": "keydown",
      "code": "ArrowUp"
    }
  ]
}
